doi,url,title,journal,pubdate,authorName,numberOfAuthors,authorPosition,affiliation,authorType
10.1111/j.1460-2466.2004.tb02621.x,https://academic.oup.com/joc/article/54/1/178/4102977,The Public Sphere as a Sphere of Publics: Rethinking Habermas's Theory of the Public Sphere,Journal of Communication,2006-01-10,Tanni Haas,1.0,1.0,"1 Tanni Haas (PhD, Rutgers) is an assistant professor in the Department of Speech Communication Arts and Sciences at Brooklyn College",Person
10.1093/ct/qty010,https://academic.oup.com/ct/article/28/4/487/5036080,The Experiential Mode of Media Reception: A Holistic Framework Concept,Communication Theory,2018-06-12,Felix Frey,1.0,1.0,"Institute of Communication and Media Studies, University of Leipzig, Leipzig, Germany",Person
10.1111/j.1460-2466.1999.tb02806.x,https://academic.oup.com/joc/article/49/3/84/4108154,Western Romance Fiction as English-Language Media in Postcolonial India,Journal of Communication,2006-02-07,Radhika Parameswaran,1.0,1.0,"1 School of Journalism, Indiana University, USA",Person
10.1111/j.1460-2466.1998.tb02756.x,https://academic.oup.com/joc/article/48/2/178/4110090,Book Reviews,Journal of Communication,2006-02-07,,,,,
10.1093/joc/jqaa022,https://academic.oup.com/joc/article/70/5/646/5900771,"The Value of Not Knowing: Partisan Cue-Taking and Belief Updating of the Uninformed, the Ambiguous, and the Misinformed",Journal of Communication,2020-09-02,Jianing Li,2.0,1.0,"School of Journalism and Mass Communication, University of Wisconsin–Madison , Madison, WI 53706,  USA",Person
10.1093/joc/jqaa022,https://academic.oup.com/joc/article/70/5/646/5900771,"The Value of Not Knowing: Partisan Cue-Taking and Belief Updating of the Uninformed, the Ambiguous, and the Misinformed",Journal of Communication,2020-09-02,Michael W Wagner,2.0,2.0,"School of Journalism and Mass Communication, University of Wisconsin–Madison , Madison, WI 53706,  USA",Person
